{"ranking":["D","A","E","B","C"],"best_option":"D","rationale":"D best satisfies the brief with an immediate “Standalone Drawing Tablet” message, dominant product presentation, strong blue/orange color use, clean hierarchy, and highly legible benefits. A is polished and feature-rich but noticeably more crowded, with small copy and competing visual elements. E communicates the standalone advantage effectively through comparison and has solid craft, though the product itself is less dominant and the layout is busier. B is clear and visually engaging but relies on “Draw Anywhere” rather than explicitly foregrounding the requested product category. C conveys the comparison but feels sparse and less refined, with awkward spacing, inconsistent copy styling, and weaker visual cohesion.","confidence":0.91,"uncertainty_notes":"The excerpt omits final dimensions, platform, exact source color scheme, and required copy or assets. Fine text is difficult to assess at the supplied resolution, but the compositions appear substantially uncropped."}