{"ranking":["E","C","D","A","B"],"best_option":"E","rationale":"E best combines a clean, light, modern contents system with engaging London imagery, clear color coding, and a convincing destination-feature spread. C is similarly polished and highly legible but feels slightly less immersive. D demonstrates a broad, consistent editorial system, though its directory pages are dense for passport scale. A is organized but repetitive and visually generic. B has a striking London cover, yet the visible interior is image-heavy and provides little evidence of usable guide hierarchy while departing from the preferred light-page treatment.","confidence":0.78,"uncertainty_notes":"Only cropped mockups are visible, fine text cannot be assessed reliably at this resolution, and the incomplete brief omits exact page count, required sections, logo palette, and production specifications."}