{"ranking":["C","A","B","E","D"],"best_option":"C","rationale":"C offers the strongest synthesis of tidal waves and rarity through a refined gem-like emblem, paired with an elegant, balanced wordmark and the requested teal/rose-gold palette. A is highly luxurious and atmospheric but loses points for the nearly illegible script tagline and very fine detailing. B is conceptually apt and versatile, though its emblem feels more architectural and less graceful. E is clear and scalable but comparatively corporate and less bespoke. D is polished and elegant, yet its celestial-wave motif feels more generic and less connected to rare, custom travel.","confidence":0.82,"uncertainty_notes":"The brief is incomplete, and the options are shown at low resolution in inconsistent presentation contexts. Fine-line scalability, small tagline legibility, metallic rose-gold execution, and full brand-launch-pack versatility cannot be fully verified."}