{"ranking":["E","D","A","C","B"],"best_option":"E","rationale":"E is the strongest overall: polished hierarchy, cohesive typography and color, clear branding, all three required artworks prominently retained, and convincing banner-level finish. D fits the standalone drawing-tablet subject most explicitly and has solid commercial structure, but its small feature text and visibly clipped edge content reduce legibility and production confidence. A is clear and energetic but comparatively generic and spatially heavy. C has strong branding but awkward cropping, a visible “LERAN” typo, and weaker refinement. B is clean but too sparse, with limited hierarchy and little communication of the product or vision.","confidence":0.86,"uncertainty_notes":"The brief omits the required dimensions and much of the requested concept; several previews also appear cropped or scaled within square canvases. This especially limits assessment of D’s edge clipping and the intended whitespace/aspect ratio in A and B."}