{"ranking":["D","E","B","C","A"],"best_option":"D","rationale":"D best combines a distinctive GHH script monogram with a warm sunrise motif and an appropriately sophisticated neutral-gold palette. Its hierarchy and demonstrated light/dark applications suggest a credible hospitality brand system, though some fine details may challenge small-scale use. E is polished, versatile, and highly legible but feels more conventional. B has strong personality and brief alignment, yet its oversized script creates a less balanced composition. C is clean and scalable but comparatively corporate and less evocative of elevated experiences. A is direct and readable, though its bright yellow/cyan treatment and simpler execution feel less sophisticated.","confidence":0.82,"uncertainty_notes":"The brief excerpt is incomplete, and the small raster previews make fine-line reproduction, exact typography, and tagline legibility difficult to assess. D and E are close; fuller brand-guide pages or stated audience and positioning could change their order."}