{"ranking":["E","C","B","D","A"],"best_option":"E","rationale":"E offers the strongest overall balance: a polished matte-and-metallic look, clear product identification, an elegant feminine botanical accent, and distinctive premium shelf presence. C is the sleekest and most Apple-like, with an apt rose-gold accent, but its extremely faint typography harms legibility. B is attractive and luxurious, though the centered illustration dominates the product hierarchy. D is clean but washed out, less feminine, and its raised lid elements seem less production-friendly. A suggests a thoughtful unboxing experience but looks comparatively dense, text-heavy, and less cohesive as luxury packaging.","confidence":0.8,"uncertainty_notes":"Only one rendered angle is shown per concept, with A uniquely displayed open. Low resolution obscures fine typography, metallic/foil realism, dieline details, and print feasibility; the incomplete brief may also omit decisive color, structure, or content requirements."}