{"ranking":["C","B","A","E","D"],"best_option":"C","rationale":"C best fulfills the stated clarity priority through strong contrast, generous type, clear iconography, and an immediately scannable 3×3 grid. B is more distinctive and editorially polished, but its supporting text is smaller. A is highly readable and consistent, though more generic. E has excellent atmosphere and craft, but its textured background, glass effects, and fine coral text reduce legibility. D remains readable, but the alternating saturated tiles fragment the hierarchy and feel less cohesive than A.","confidence":0.81,"uncertainty_notes":"The excerpt omits the supplied mockup, exact output dimensions, and possible brand requirements. The 500px previews also make small supporting copy difficult to judge; a premium or contextual-image requirement could favor B or E more strongly."}