{"ranking":["A","B","C","E","D"],"best_option":"A","rationale":"A best connects the ibex directly to survival and preparedness through rugged gear, an alpine stance, oversized curved horns, and a dynamic, memorable silhouette. B is the cleanest and most immediately logo-like, with strong legibility and a trustworthy expression, but feels more generic and less tied to survival. C and E are polished and appealing but overly cute and provide little alpine or preparedness context; they appear visually identical, so their order is nominal. D includes useful survival gear but has weaker anatomy, refinement, scalability, and a less trustworthy expression.","confidence":0.87,"uncertainty_notes":"The brief excerpt is incomplete, so unknown style, usage, and branding constraints could change the weighting. Low-resolution presentation limits assessment of fine line quality and reproduction readiness. C and E are indistinguishable in the attached pixels and cannot be meaningfully separated."}