{"ranking":["A","E","B","C","D"],"best_option":"A","rationale":"A best combines luxury, holiday warmth, travel symbolism, and the chopstick gift in a polished, legible composition. E is exceptionally restrained and premium, though its travel connection is mostly conveyed through copy and branding. B offers the cleverest travel/chopstick integration, but has limited holiday character and a slightly severe composition. C fits the theme directly but feels less refined and typographically resolved. D is distinctive and festive, yet more whimsical than luxurious, and the visible phrase “a table of adventure” appears erroneous.","confidence":0.91,"uncertainty_notes":"Judgment is limited by the small previews and incomplete brief; fine typography, print-ready detail, intended card format, and any omitted branding or copy requirements cannot be verified."}