{"ranking":["D","A","E","B","C"],"best_option":"D","rationale":"D offers the strongest overall hierarchy, distinctiveness, and promotional impact. Its disciplined grid, bold typography, readable information blocks, black-and-white imagery, warm-grey field, and controlled negative space feel polished and production-ready. A is atmospheric and cohesive but its reverse is comparatively dense. E has an equally appealing cover, though its reverse is less balanced and the tower treatment feels awkward. B is informative but busier, with weaker text-over-image legibility. C embraces negative space elegantly but feels too sparse and typographically small for effective display promotion.","confidence":0.8,"uncertainty_notes":"The low resolution prevents reliable assessment of body-copy legibility and fine print quality. Option D also appears partially cropped at the top, and omitted brief details about format, required content, or sidedness could change the relative ranking of D and A."}