{"ranking":["D","B","A","C","E"],"best_option":"D","rationale":"D is the strongest brief fit: it presents the exact name in a compact, legible mark, combines shopping and TV cues clearly, adds a clever travel/orbit element, and demonstrates plausible light/dark reproduction. B is the most polished alternative but emphasizes travel more than shopping. A and C are attractive yet busier and more reliant on familiar pin/airplane motifs. E is playful and distinctive, but the incorrect apostrophe in “HAPPEN’S,” illustrative complexity, and fine mascot details materially reduce immediate usability and scalability.","confidence":0.82,"uncertainty_notes":"The brief is incomplete, so the importance of the repeated travel imagery is unclear. D is also displayed at a smaller scale than the other primary marks, and the available resolution limits close assessment of its fine details."}