{"ranking":["A","E","D","B","C"],"best_option":"A","rationale":"A best balances an immediately scannable full-year heatmap, clear month/weekday structure, useful weekly summaries, restrained branding, and credible DIN A4 production. E has similarly strong information design and superior close-up legibility, but the crop prevents judging the complete calendar and overall hierarchy. D uses a familiar 12-month format and is clean, though density patterns are less quickly comparable across the year. B appears comprehensive but is overly dense and likely difficult to read at A4 size. C is visually distinctive and approachable, but the large illustration consumes functional space and only January is shown, making it the weakest demonstrated fit for a functional annual overview.","confidence":0.9,"uncertainty_notes":"Fine text and numerical legibility cannot be verified at the supplied resolution. E is materially cropped, while C may represent one page of a larger system; the incomplete brief also leaves exact data-labeling and branding requirements unknown."}