{"ranking":["C","D","E","A","B"],"best_option":"C","rationale":"C best conveys luxury through its elegant gold wing monogram, refined typography, strong hierarchy, and clean, production-ready composition. D is similarly polished and upscale but feels more conventional and its stacked wordmark is less fluid. E is clean and legible but too minimal and generic to be distinctive. A and B are energetic and versatile, yet their central winged symbol reads more like a tooth or wellness-clinic emblem than luxury group travel; A’s navy-and-gold palette is more refined than B’s blue-orange gradient.","confidence":0.91,"uncertainty_notes":"The brief excerpt is incomplete, and the small raster previews limit assessment of fine typography, spacing, and very-small-size reproduction. Only A and B visibly demonstrate reversed applications."}